{
  "evidence_required": [
    "source",
    "sink",
    "control"
  ],
  "expected_cwe": "CWE-732",
  "expected_status": "candidate",
  "id": "eval.object-storage.positive",
  "polarity": "positive",
  "query": "Object-storage public exposure and key-scope failure object key, bucket policy or signed URL object storage API or CDN",
  "safe_boundary": "local synthetic fixture; no network and no real credentials",
  "snippet": "synthetic canary from object key, bucket policy or signed URL reaches object storage API or CDN without the documented control",
  "vulnerability_id": "vuln.files.object-storage"
}
