{
  "evidence_required": [
    "source",
    "sink",
    "control"
  ],
  "expected_cwe": "CWE-441",
  "expected_status": "candidate",
  "id": "eval.capability-confusion.positive",
  "polarity": "positive",
  "query": "Capability and destination confusion destination, tool name or capability token network call, cloud action or tool invocation",
  "safe_boundary": "local synthetic fixture; no network and no real credentials",
  "snippet": "synthetic canary from destination, tool name or capability token reaches network call, cloud action or tool invocation without the documented control",
  "vulnerability_id": "vuln.authorization.capability-confusion"
}
