{
  "evidence_required": [
    "source",
    "sink",
    "control"
  ],
  "expected_cwe": "CWE-1188",
  "expected_status": "candidate",
  "id": "eval.insecure-default.positive",
  "polarity": "positive",
  "query": "Insecure default configuration missing configuration or deployment value startup policy, listener or access decision",
  "safe_boundary": "local synthetic fixture; no network and no real credentials",
  "snippet": "synthetic canary from missing configuration or deployment value reaches startup policy, listener or access decision without the documented control",
  "vulnerability_id": "vuln.configuration.insecure-default"
}
