{
  "evidence_required": [
    "source",
    "sink",
    "control"
  ],
  "expected_cwe": "CWE-269",
  "expected_status": "candidate",
  "id": "eval.k8s-service-account.positive",
  "polarity": "positive",
  "query": "Kubernetes service-account and workload identity overreach pod spec, service account token or workload identity binding Kubernetes/cloud control-plane API",
  "safe_boundary": "local synthetic fixture; no network and no real credentials",
  "snippet": "synthetic canary from pod spec, service account token or workload identity binding reaches Kubernetes/cloud control-plane API without the documented control",
  "vulnerability_id": "vuln.cloud.k8s-service-account"
}
