{
  "evidence_required": [
    "source",
    "sink",
    "control"
  ],
  "expected_cwe": "CWE-200",
  "expected_status": "candidate",
  "id": "eval.inventory.positive",
  "polarity": "positive",
  "query": "Incomplete API inventory and shadow endpoint exposure route, schema, version or protocol discovery shadow endpoint or deprecated handler",
  "safe_boundary": "local synthetic fixture; no network and no real credentials",
  "snippet": "synthetic canary from route, schema, version or protocol discovery reaches shadow endpoint or deprecated handler without the documented control",
  "vulnerability_id": "vuln.api.inventory"
}
